{"ancestors":["aa3dab68b9434c99eba265ad506686b7222a362758a7be2c06bba2c737846b0b"],"manifest":"intentline.sources","predecessor":{"contract_id":"username-validation","contract_sha256":"d90bb780c7b0a6769cfded322e69aeed1ad716dba94faf6dea5a256f588f0c43","revision":1,"snapshot_sha256":"aa3dab68b9434c99eba265ad506686b7222a362758a7be2c06bba2c737846b0b","source_bundle_sha256":"d1912c64f2aab0cc80e202a345c06559626aabde5eef3b5fd0c311e25800e25d"},"root":"/private/tmp/intentline03-installed-host-smoke","schema_version":2,"sources":[{"bytes":43,"declared_authority":"user_request","identity":{"device":16777230,"inode":128516879},"original_location":"/private/tmp/intentline03-installed-host-smoke/request.md","predecessor_source_bundle_sha256":"d1912c64f2aab0cc80e202a345c06559626aabde5eef3b5fd0c311e25800e25d","predecessor_source_id":"S1","provenance":"frozen_historical","relative_path":"request.md","role":"request","sha256":"74619d9b72f3031a6385955c65bba5c9821bc71f942922d453d18dfd2bd6afaf","source_id":"S1"},{"bytes":43,"declared_authority":"operator_asserted_amendment","identity":{"device":16777230,"inode":128516897},"original_location":"/private/tmp/intentline03-installed-host-smoke/amendment.md","provenance":"current","relative_path":"amendment.md","role":"amendment","sha256":"01ccb08b27abcf1cc0a9f23e0e2b96c5bf66722b375f0d5aec5fbf5e34620d95","source_id":"S2"}]}
